{
  "$schema": "https://json-schema.org/draft/2020-12/schema",
  "title": "AgentTurnOutput",
  "description": "Formal schema for the structured output generated by the agent/model in each dialogue turn.",
  "type": "object",
  "additionalProperties": false,
  "required": [
    "system_response",
    "decision_trace",
    "safety_state",
    "policy_outputs"
  ],
  "properties": {
    "system_response": {
      "type": "string",
      "minLength": 1,
      "description": "Conversational text response addressed to the student."
    },
    "decision_trace": {
      "type": "array",
      "items": {
        "$ref": "trace_event.schema.json"
      },
      "minItems": 1,
      "description": "Explicit typed trace of procedural and policy decisions made during the turn."
    },
    "safety_state": {
      "$ref": "safety_state.schema.json",
      "description": "Updated safety state at the end of the turn."
    },
    "policy_outputs": {
      "type": "object",
      "additionalProperties": false,
      "required": [
        "safety_envelope"
      ],
      "properties": {
        "safety_envelope": {
          "$ref": "safety_envelope_output.schema.json",
          "description": "Formal output of the safety envelope (POL-04 and POL-05), always present."
        },
        "pol01": {
          "$ref": "pol01_output.schema.json",
          "description": "Optional structured output for policy POL-01 (Implementation Intentions)."
        },
        "pol02": {
          "$ref": "pol02_output.schema.json",
          "description": "Optional structured output for policy POL-02 (Graded Scaffolding)."
        },
        "pol03": {
          "$ref": "pol03_output.schema.json",
          "description": "Optional structured output for policy POL-03 (Accepted Next Action)."
        }
      }
    }
  }
}
